{
  "id": "chikmagalur-2026",
  "title": "Chikmagalur Coffee & Cloud Peaks",
  "destination": "Chikmagalur, Karnataka, India",
  "flag": "🇮🇳",
  "status": "past",
  "category": "roadtrip",
  "dates": "Sep 12 – 14, 2026",
  "startDate": "2026-09-12",
  "endDate": "2026-09-14",
  "daysCount": 3,
  "travelers": "2–3 Travelers",
  "heroGradient": "from-emerald-950 via-teal-900 to-slate-950",
  "badge": "Hill Station • Western Ghats",
  "accentColor": "#10b981",
  "summary": "A 3-day weekend escape across lush coffee plantations, rugged 4x4 trails to roaring waterfalls, highest peak trekking at Mullayanagiri (1,930m), and scenic ridge cruising on 125cc scooties.",
  "basecamp": {
    "name": "Tresca A Luxury Hotel",
    "location": "RG Road, Vijayapura (Opp. Renukacharya Kalyana Mantapa)",
    "distanceFromStation": "850 meters (~2 mins by auto) from KSRTC Main Bus Stand",
    "checkIn": "12:00 PM",
    "checkOut": "11:00 AM",
    "arrivalStrategy": "Arrive at 9:30 AM (2.5 hrs before check-in). Drop bags securely at the 24-hr cloakroom, freshen up in the lobby washroom, change into hill clothes, and head out immediately for breakfast and sightseeing without luggage.",
    "diningNote": "Clean, modern rooms; no in-house kitchen. RG Road features premier dining within 2–5 min walk (Vishnu Delicacy, Town Caffee, Kailash Parbat, Hotel Matsya).",
    "coords": [13.3182, 75.7788],
    "addressLocalScript": "ಟ್ರೆಸ್ಕಾ ಎ ಲಕ್ಸುರಿ ಹೋಟೆಲ್, ಆರ್.ಜಿ. ರಸ್ತೆ, ವಿಜಯಪುರ, ರೇಣುಕಾಚಾರ್ಯ ಕಲ್ಯಾಣ ಮಂಟಪದ ಎದುರು, ಚಿಕ್ಕಮಗಳೂರು"
  },
  "transportPlan": [
    {
      "day": "Saturday (Day 1)",
      "mode": "Private Sightseeing Cab + 4x4 Jeep",
      "icon": "fa-taxi",
      "timing": "~10:30 AM to 07:00 PM",
      "purpose": "Picks up at Tresca Hotel, handles steep hairpins, Jhari falls jeep switch point, and Mullayanagiri climb."
    },
    {
      "day": "Sunday (Day 2)",
      "mode": "125cc Scooty Rental",
      "icon": "fa-motorcycle",
      "timing": "Pickup 09:00 AM near KSRTC Bus Stand",
      "purpose": "Cruise scenic plantation loops, winding roads to Baba Budangiri, Z-Point trek, and plantation cafe hopping."
    },
    {
      "day": "Monday (Day 3)",
      "mode": "125cc Scooty + Overnight Sleeper Bus",
      "icon": "fa-bus",
      "timing": "Return Scooty by 08:30 PM • Bus at 11:00 PM",
      "purpose": "Belur Hoysala Temple or Aldur green corridor + town spice & coffee shopping. Overnight AC Sleeper bus back to Bengaluru."
    }
  ],
  "mapCenter": [13.3650, 75.7500],
  "mapZoom": 11,
  "locations": [
    {
      "id": "tresca",
      "name": "Tresca A Luxury Hotel",
      "category": "stay",
      "coords": [13.3182, 75.7788],
      "desc": "Base camp on RG Road. 850m from KSRTC stand. 24-hr luggage cloakroom.",
      "day": 1,
      "time": "09:30 AM Arrival",
      "icon": "fa-hotel",
      "color": "pin-rose"
    },
    {
      "id": "vishnu",
      "name": "Vishnu Delicacy / Town Caffee",
      "category": "food",
      "coords": [13.3195, 75.7765],
      "desc": "Quick South Indian breakfast and filter coffee right on RG Road.",
      "day": 1,
      "time": "10:15 AM",
      "icon": "fa-utensils",
      "color": "pin-amber"
    },
    {
      "id": "jhari",
      "name": "Jhari (Buttermilk) Falls",
      "category": "nature",
      "coords": [13.4116, 75.7663],
      "desc": "Switch to 4x4 open jeep (~₹800) at estate checkpost for thrilling muddy off-road ride.",
      "day": 1,
      "time": "11:45 AM – 01:45 PM",
      "icon": "fa-water",
      "color": "pin-cyan"
    },
    {
      "id": "siri-lunch",
      "name": "Siri Cafe / Countryside Lunch",
      "category": "food",
      "coords": [13.3361, 75.7631],
      "desc": "Malnad lunch stop along the hill route before the afternoon climb.",
      "day": 1,
      "time": "02:00 PM – 03:00 PM",
      "icon": "fa-bowl-food",
      "color": "pin-amber"
    },
    {
      "id": "mullayanagiri",
      "name": "Mullayanagiri Peak",
      "category": "viewpoint",
      "coords": [13.3911, 75.7214],
      "desc": "Highest point in Karnataka (1,930m). Stone steps along windy ridge with drifting clouds.",
      "day": 1,
      "time": "03:30 PM – 05:30 PM",
      "icon": "fa-mountain",
      "color": "pin-emerald"
    },
    {
      "id": "hirekolale",
      "name": "Hirekolale Lake",
      "category": "viewpoint",
      "coords": [13.3639, 75.7275],
      "desc": "Tranquil stone embankment to watch the golden sunset reflecting over mountain waters.",
      "day": 1,
      "time": "05:45 PM – 06:45 PM",
      "icon": "fa-sun",
      "color": "pin-purple"
    },
    {
      "id": "scooty",
      "name": "Scooty Rental Hub",
      "category": "transport",
      "coords": [13.3155, 75.7730],
      "desc": "Walk 500m towards KSRTC Bus Stand / Barlane Rd. Collect 125cc scooter.",
      "day": 2,
      "time": "09:30 AM",
      "icon": "fa-motorcycle",
      "color": "pin-blue"
    },
    {
      "id": "bababudangiri",
      "name": "Baba Budangiri & Z-Point",
      "category": "nature",
      "coords": [13.4241, 75.7672],
      "desc": "Winding ghat roads through coffee estates. Dramatic narrow ridge walk with deep valley drops.",
      "day": 2,
      "time": "10:00 AM – 01:30 PM",
      "icon": "fa-person-hiking",
      "color": "pin-emerald"
    },
    {
      "id": "museum",
      "name": "Coffee Museum & Plantation Cafe",
      "category": "culture",
      "coords": [13.3276, 75.7766],
      "desc": "Coffee Board of India museum + fresh artisanal pour-overs at Cafe Agape or World of Coffee.",
      "day": 2,
      "time": "03:30 PM – 05:30 PM",
      "icon": "fa-mug-hot",
      "color": "pin-amber"
    },
    {
      "id": "belur",
      "name": "Belur Chennakeshava Temple (Option A)",
      "category": "culture",
      "coords": [13.1623, 75.8601],
      "desc": "12th-century UNESCO heritage Hoysala soapstone temple with intricate star-shaped architecture.",
      "day": 3,
      "time": "11:30 AM – 03:00 PM",
      "icon": "fa-gopuram",
      "color": "pin-purple"
    },
    {
      "id": "shopping",
      "name": "Panduranga & Classic Coffee (MG Road)",
      "category": "shopping",
      "coords": [13.3175, 75.7745],
      "desc": "Fresh ground Arabica/Robusta blends, green cardamom, black pepper, cinnamon, and fresh banana chips.",
      "day": 3,
      "time": "05:00 PM – 07:30 PM",
      "icon": "fa-bag-shopping",
      "color": "pin-blue"
    },
    {
      "id": "ksrtc",
      "name": "KSRTC Main Bus Stand",
      "category": "transport",
      "coords": [13.3149, 75.7722],
      "desc": "Board 11:00 PM AC Sleeper bus back to Bengaluru (arrives ~05:00 AM Tuesday).",
      "day": 3,
      "time": "10:15 PM Boarding",
      "icon": "fa-bus",
      "color": "pin-blue"
    }
  ],
  "itinerary": [
    {
      "dayNumber": 1,
      "date": "Saturday, Sep 12, 2026",
      "title": "Waterfalls, Cloud Walks & Sunset",
      "highlight": "Private Cab + 4x4 Off-Road Jeep",
      "transportBadge": "Cab + Jeep",
      "events": [
        {
          "time": "09:30 AM – 10:15 AM",
          "title": "Arrival & Strategic Bag Drop at Tresca",
          "category": "logistics",
          "locationId": "tresca",
          "desc": "Arrive in Chikmagalur. Take a 2-min auto (850m) to Tresca A Luxury Hotel. Drop bags at 24-hr cloakroom, freshen up in lobby washroom, change into comfortable hill attire.",
          "tip": "Don't wait for standard 12:00 PM check-in; get out into the hills immediately without luggage!",
          "badge": "Bag Drop"
        },
        {
          "time": "10:15 AM – 10:45 AM",
          "title": "South Indian Breakfast & Filter Kaapi",
          "category": "food",
          "locationId": "vishnu",
          "desc": "Quick crispy dosas, idli-vada, and piping hot Chikmagalur filter coffee at Vishnu Delicacy or Town Caffee on RG Road.",
          "tip": "Fuel up well before the mountain drive.",
          "badge": "Breakfast"
        },
        {
          "time": "11:00 AM",
          "title": "Private Cab Pickup at Tresca",
          "category": "transport",
          "locationId": "tresca",
          "desc": "Your pre-arranged private cab picks you up directly from hotel porch to handle hairpin ghat curves.",
          "tip": "Keep a light rain jacket/windcheater and cash handy.",
          "badge": "Cab Pickup"
        },
        {
          "time": "11:45 AM – 01:45 PM",
          "title": "Jhari (Buttermilk) Falls Off-Roading",
          "category": "nature",
          "locationId": "jhari",
          "desc": "Cab drops at estate checkpost. Switch to local 4x4 open jeep (~₹800 per jeep) for a thrilling, muddy off-road descent through private coffee plantations to the roaring falls.",
          "tip": "Wear water-resistant footwear with good grip. Rocky surfaces can be slippery.",
          "badge": "Must Visit"
        },
        {
          "time": "02:00 PM – 03:00 PM",
          "title": "Countryside Malnad Lunch",
          "category": "food",
          "locationId": "siri-lunch",
          "desc": "Relaxed lunch stop at Siri Cafe or a traditional Malnad eatery along the route.",
          "tip": "Try local Akki Roti or mild coconut vegetable curry.",
          "badge": "Lunch"
        },
        {
          "time": "03:30 PM – 05:30 PM",
          "title": "Mullayanagiri Peak Climb (Highest in Karnataka)",
          "category": "viewpoint",
          "locationId": "mullayanagiri",
          "desc": "Afternoon timing is strategic: morning tourist rush has cleared. Climb the stone steps along the windy ridge to the 1,930m peak for panoramic views through drifting mist.",
          "tip": "Can get very windy and chilly; zip up your windcheaters.",
          "badge": "Peak Trek"
        },
        {
          "time": "05:45 PM – 06:45 PM",
          "title": "Hirekolale Lake Golden Hour",
          "category": "viewpoint",
          "locationId": "hirekolale",